<?xml version="1.0" encoding="UTF-8"?>
<xs:schema xmlns:xs="http://www.w3.org/2001/XMLSchema">
  <xs:complexType name="OptionType">
    <xs:sequence>
      <xs:element name="Name" type="xs:string" />
      <xs:element name="DefaultValue" type="xs:string" />
    </xs:sequence>
  </xs:complexType>

  <xs:element name="PenmuxModuleOptions">
    <xs:complexType>
      <xs:sequence>
        <xs:element name="Option" type="OptionType" minOccurs="1" maxOccurs="unbounded" />
      </xs:sequence>
    </xs:complexType>
  </xs:element>
</xs:schema>
